{
  "business_name": "Petals Hair & Beauty Westport",
  "vertical_bucket": "Health and Wellness",
  "what_matters_in_this_vertical": [
    "Trust and credibility signals visible on the site",
    "Clear and accessible booking or consultation pathway",
    "Local search visibility for service and location-specific queries",
    "Strong presentation of services to support new client decision-making",
    "Online reputation actively reinforcing the in-person experience"
  ],
  "likely_customer_intent": [
    "Find a reputable local hair or beauty salon in Westport",
    "Browse available services and pricing before committing",
    "Book an appointment quickly and with confidence",
    "Check reviews or reputation before visiting for the first time",
    "Find contact details or ask a quick question before booking"
  ],
  "commercial_risk_if_unaddressed": "A confusing navigation structure and a hard-to-find contact form mean that new visitors arriving from Google search may leave before reaching the booking system, directing potential appointments toward competitors with a cleaner online experience. Given the salon's strong review profile, the current website is not converting the trust already earned in the local market.",
  "strongest_positioning_angle": "Petals has one of the strongest local reputations in Westport with 312 reviews at 4.8 stars, but the website is not yet structured to turn that trust into new bookings from organic search visitors.",
  "top_3_outreach_talking_points": [
    "Your Google review profile is genuinely impressive and puts you ahead of most salons in Mayo, but right now the website isn't surfacing that reputation where new visitors can see it, which means some of that trust is being left on the table.",
    "There are a few quick structural changes to the navigation and contact pathway that would make it significantly easier for people landing on the site to find what they need and book, without requiring a full rebuild.",
    "Adding a small amount of locally relevant content to the site over time would help Petals appear more consistently in search results for people in Westport and surrounding areas actively looking for a salon, at a stage when they haven't yet heard of you through word of mouth."
  ],
  "likely_objections": [
    "We already have a website and a booking system through Phorest",
    "Most of our new clients come through Instagram or word of mouth",
    "We don't have time to manage a blog or write content",
    "We're not sure what we can actually change on a Phorest site"
  ],
  "recommended_offer_angle": "Given the medium opportunity level and SEO optimisation as the primary service angle, a strong entry point would be a focused website review session, presented as a no-commitment visual audit walk-through, leading into a proposal for a defined scope of navigation restructuring, trust signal integration, and on-page SEO improvements that work within or alongside the existing Phorest setup.",
  "unknowns_to_clarify": [
    "How much design and SEO control does the owner currently have within their Phorest plan, and are they open to a custom front-end solution if platform limitations are confirmed?",
    "Is the business actively managing social media, and is there an existing content or promotion strategy that could be aligned with a blog or updates section?",
    "Who manages the website currently, is it handled in-house, through Phorest support, or via an existing agency relationship?",
    "Is the owner aware of the desktop PageSpeed issue, and has any performance work been attempted previously?"
  ]
}